{
  "schemaVersion": "sapphirus.model-access-receipt.v2",
  "receiptId": "receipt_01J00000000000000000000000",
  "requestId": "request_01J00000000000000000000000",
  "runId": "run_01J00000000000000000000000",
  "requestHash": "sha256:1111111111111111111111111111111111111111111111111111111111111111",
  "resultHash": "sha256:2222222222222222222222222222222222222222222222222222222222222222",
  "deliveryModel": "windows_local",
  "tenantHash": "sha256:1111111111111111111111111111111111111111111111111111111111111111",
  "subjectHash": "sha256:2222222222222222222222222222222222222222222222222222222222222222",
  "registrationId": "dreg_01J00000000000000000000000",
  "manifestHash": "sha256:7777777777777777777777777777777777777777777777777777777777777777",
  "invocationBindingHash": "sha256:8888888888888888888888888888888888888888888888888888888888888888",
  "consumptionHash": "sha256:9999999999999999999999999999999999999999999999999999999999999999",
  "consentEnvelopeHash": "sha256:0000000000000000000000000000000000000000000000000000000000000000",
  "consentDisclosureHash": "sha256:aaaaaaaaaaaaaaaaaaaaaaaaaaaaaaaaaaaaaaaaaaaaaaaaaaaaaaaaaaaaaaaa",
  "providerProfileHash": "sha256:bbbbbbbbbbbbbbbbbbbbbbbbbbbbbbbbbbbbbbbbbbbbbbbbbbbbbbbbbbbbbbbb",
  "modelProfileHash": "sha256:cccccccccccccccccccccccccccccccccccccccccccccccccccccccccccccccc",
  "modelCapabilityHash": "sha256:dddddddddddddddddddddddddddddddddddddddddddddddddddddddddddddddd",
  "responseLane": {
    "requestMode": "structured_response",
    "supportRoute": "model_access",
    "canonicalOutputSchemaId": "sapphirus.bmad-method-help-proposal.v1",
    "canonicalOutputSchemaHash": "sha256:6666666666666666666666666666666666666666666666666666666666666666",
    "providerSchemaProjectionHash": "sha256:3333333333333333333333333333333333333333333333333333333333333333"
  },
  "requestedProfileId": "coding-balanced",
  "resolvedProfileId": "coding-balanced",
  "resolvedProfileHash": "sha256:cccccccccccccccccccccccccccccccccccccccccccccccccccccccccccccccc",
  "requestedVariantId": "balanced",
  "resolvedVariantId": "balanced",
  "catalogVersion": "v1.0123456789abcdef",
  "catalogHash": "sha256:0000000000000000000000000000000000000000000000000000000000000000",
  "deploymentInventoryHash": "sha256:dddddddddddddddddddddddddddddddddddddddddddddddddddddddddddddddd",
  "resolvedDeploymentHash": "sha256:eeeeeeeeeeeeeeeeeeeeeeeeeeeeeeeeeeeeeeeeeeeeeeeeeeeeeeeeeeeeeeee",
  "resolvedModel": {
    "publisher": "FixturePublisher",
    "name": "fixture-model",
    "version": "2026-06-01"
  },
  "reportedResponseModel": "fixture-model-2026-06-01",
  "credentialBindingHash": "sha256:4444444444444444444444444444444444444444444444444444444444444444",
  "retentionMode": "transient_no_store",
  "region": "westeurope",
  "inputBytes": 8421,
  "outputBytes": 1200,
  "usage": {
    "usageProvenance": "reported",
    "inputTokens": 2100,
    "outputTokens": 300,
    "reasoningTokens": 180,
    "cacheReadTokens": null,
    "cacheWriteTokens": null,
    "costMicrounits": 7200,
    "currency": "EUR",
    "priceProfileVersion": "foundry-price-2026-07"
  },
  "retryCount": 0,
  "fallbackEvents": [],
  "providerRequestId": "provider-request-opaque",
  "startedAt": "2026-07-28T10:00:01.000Z",
  "completedAt": "2026-07-28T10:00:02.000Z",
  "terminalStatus": "succeeded",
  "receiptHash": "sha256:5555555555555555555555555555555555555555555555555555555555555555",
  "proof": {
    "proofType": "support_plane_signature",
    "algorithm": "ES256",
    "issuer": "https://support.sapphirus.example/",
    "audience": "sapphirus-desktop",
    "keyId": "model-receipt-key-2026-07",
    "signedPayloadHash": "sha256:5555555555555555555555555555555555555555555555555555555555555555",
    "signature": "ZXhhbXBsZS1zdXBwb3J0LXBsYW5lLXNpZ25hdHVyZQ"
  }
}
